{
  "schemaVersion":1,"kind":"ModuleDocumentationManifestV1","moduleId":"module.scheduler-core","registryRef":"docs/system/truth/modules.v1.json#/modules/module.scheduler-core","specPath":"docs/modules/specs/scheduler-core.md","runbookPath":"docs/modules/specs/scheduler-core.md#operational-runbook","implementationPaths":["docs/control-plane/GLOBAL_OPTIMIZATION.md","docs/control-plane/SCHEDULER_STATE_MACHINE.md","rust/crates/hepta-control-plane","rust/crates/hepta-orchestration-kernel/src/calibration.rs","rust/crates/hepta-orchestration-kernel/HANDOFF.md"],"capabilityIds":["CAP-SCH-PLAN"],"authorityClass":"pure","ownerTeams":["TEAM-SCHEDULER","TEAM-KERNEL","TEAM-EVIDENCE"],"dependencyModuleIds":["module.candidate-router","module.resource-allocator"],"workItemIds":["SCH-001","SCH-002","SCH-003","SCH-004","SCH-005","SCH-006","SCH-007"],"qualificationRequirement":"source","protocolRange":{"minimum":1,"maximum":1},"sideEffectClasses":["none"],"determinismClass":"deterministic","resourceProfile":{"sourceContract":"bounded","deploymentProfileRequired":true,"implicitCapacityAllowed":false,"unboundedChildConcurrencyAllowed":false},"sloProfile":{"status":"source_contract_defined","canonicalWorkloadsRequired":true,"zeroToleranceSafetyCountersRequired":true},"rollout":{"currentStaticActivation":"disabled","automaticActivation":false,"productionActivation":false,"rollbackTargetRequired":true,"mutualExclusionRequired":false},"documentationStatus":"complete","effectiveQualification":"derived_only"
}
