{
  "schemaVersion":1,"kind":"ModuleDocumentationManifestV1","moduleId":"module.execution-dispatcher","registryRef":"docs/system/truth/modules.v1.json#/modules/module.execution-dispatcher","specPath":"docs/modules/specs/execution-dispatcher.md","runbookPath":"docs/modules/specs/execution-dispatcher.md#operational-runbook",
  "implementationPaths":["docs/control-plane/COMPOSITION_ROOT.md","docs/control-plane/REPLAN_AND_RECOVERY.md","rust/crates/hepta-control-plane","rust/crates/hepta-codex-broker/src/codex_dispatch.rs"],
  "capabilityIds":["CAP-EXE-DISPATCH","CAP-MOD-EXECUTION"],"authorityClass":"prepared_result_only","ownerTeams":["TEAM-RUNTIME","TEAM-KERNEL","TEAM-EVIDENCE"],"dependencyModuleIds":["module.codex-broker","module.workspace-authority"],"workItemIds":["CTL-005","MOD-003"],"qualificationRequirement":"source","protocolRange":{"minimum":1,"maximum":1},"sideEffectClasses":["local_ephemeral","workspace_mutation","prepared_result"],"determinismClass":"deterministic","resourceProfile":{"sourceContract":"bounded","deploymentProfileRequired":true,"implicitCapacityAllowed":false,"unboundedChildConcurrencyAllowed":false},"sloProfile":{"status":"source_contract_defined","canonicalWorkloadsRequired":true,"zeroToleranceSafetyCountersRequired":true},"rollout":{"currentStaticActivation":"disabled","automaticActivation":false,"productionActivation":false,"rollbackTargetRequired":true,"mutualExclusionRequired":false},"documentationStatus":"complete","effectiveQualification":"derived_only"
}
