{
  "schemaVersion":1,"kind":"ModuleDocumentationManifestV1","moduleId":"module.policy-engine","registryRef":"docs/system/truth/modules.v1.json#/modules/module.policy-engine","specPath":"docs/modules/specs/policy-engine.md","runbookPath":"docs/modules/specs/policy-engine.md#operational-runbook","implementationPaths":["docs/control-plane/COMPOSITION_ROOT.md","docs/system/INVARIANTS.md","rust/crates/hepta-control-plane"],"capabilityIds":["CAP-CTL-POLICY"],"authorityClass":"pure","ownerTeams":["TEAM-KERNEL","TEAM-EVIDENCE","TEAM-STATE"],"dependencyModuleIds":["module.snapshot-builder"],"workItemIds":["CTL-003"],"qualificationRequirement":"source","protocolRange":{"minimum":1,"maximum":1},"sideEffectClasses":["none"],"determinismClass":"deterministic","resourceProfile":{"sourceContract":"bounded","deploymentProfileRequired":true,"implicitCapacityAllowed":false,"unboundedChildConcurrencyAllowed":false},"sloProfile":{"status":"source_contract_defined","canonicalWorkloadsRequired":true,"zeroToleranceSafetyCountersRequired":true},"rollout":{"currentStaticActivation":"disabled","automaticActivation":false,"productionActivation":false,"rollbackTargetRequired":true,"mutualExclusionRequired":false},"documentationStatus":"complete","effectiveQualification":"derived_only"
}
