{
  "schemaVersion": 1,
  "kind": "ModuleDocumentationManifestV1",
  "moduleId": "module.cutover-controller",
  "registryRef": "docs/system/truth/modules.v1.json#/modules/module.cutover-controller",
  "specPath": "docs/modules/specs/cutover-controller.md",
  "runbookPath": "docs/modules/specs/cutover-controller.md#operational-runbook",
  "implementationPaths": ["rust/crates/hepta-cutover","paper-adapters/migration/rust-cutover-fence.mjs","paper-adapters/persistence/sqlite-store.mjs"],
  "capabilityIds": ["CAP-MIG-CUTOVER"],
  "authorityClass": "prepared_result_only",
  "ownerTeams": ["TEAM-KERNEL","TEAM-STATE","TEAM-EVIDENCE"],
  "dependencyModuleIds": ["module.compatibility-kernel","module.commit-sequencer"],
  "workItemIds": ["MIG-005","MIG-006"],
  "qualificationRequirement": "source",
  "protocolRange": {"minimum":1,"maximum":1},
  "sideEffectClasses": ["local_ephemeral","workspace_mutation","prepared_result"],
  "determinismClass": "deterministic",
  "resourceProfile": {"sourceContract":"bounded","deploymentProfileRequired":true,"implicitCapacityAllowed":false,"unboundedChildConcurrencyAllowed":false},
  "sloProfile": {"status":"source_contract_defined","canonicalWorkloadsRequired":true,"zeroToleranceSafetyCountersRequired":true},
  "rollout": {"currentStaticActivation":"disabled","automaticActivation":false,"productionActivation":false,"rollbackTargetRequired":true,"mutualExclusionRequired":false},
  "documentationStatus": "complete",
  "effectiveQualification": "derived_only"
}
