{
  "schemaVersion":1,"kind":"ModuleDocumentationManifestV1","moduleId":"module.submission-port","registryRef":"docs/system/truth/modules.v1.json#/modules/module.submission-port","specPath":"docs/modules/specs/submission-port.md","runbookPath":"docs/modules/specs/submission-port.md#operational-runbook","implementationPaths":["paper-domain/submission","paper-adapters","rust/crates/hepta-paper-service/src/native_business/local_submission_preflight/mod.rs"],"capabilityIds":["CAP-SUBMIT","CAP-REL-VERIFY"],"authorityClass":"external_effect","ownerTeams":["TEAM-RELEASE","TEAM-EVIDENCE","TEAM-KERNEL"],"dependencyModuleIds":["module.external-authority-verifier"],"workItemIds":["SUBMIT-001"],"qualificationRequirement":"external_authority","protocolRange":{"minimum":1,"maximum":1},"sideEffectClasses":["external_effect","portal_mutation","submission"],"determinismClass":"external_observation","resourceProfile":{"sourceContract":"bounded","deploymentProfileRequired":true,"implicitCapacityAllowed":false,"unboundedChildConcurrencyAllowed":false},"sloProfile":{"status":"baseline_pending","canonicalWorkloadsRequired":true,"zeroToleranceSafetyCountersRequired":true},"rollout":{"currentStaticActivation":"disabled","automaticActivation":false,"productionActivation":false,"rollbackTargetRequired":true,"mutualExclusionRequired":true},"documentationStatus":"complete","effectiveQualification":"derived_only"
}
