{
  "schemaVersion":1,"kind":"ModuleDocumentationManifestV1","moduleId":"module.external-authority-verifier","registryRef":"docs/system/truth/modules.v1.json#/modules/module.external-authority-verifier","specPath":"docs/modules/specs/external-authority-verifier.md","runbookPath":"docs/modules/specs/external-authority-verifier.md#operational-runbook",
  "implementationPaths":["rust/crates/hepta-external-authority","rust/crates/hepta-external-authority/HANDOFF.md"],"capabilityIds":["CAP-REL-VERIFY"],"authorityClass":"read_only","ownerTeams":["TEAM-RELEASE","TEAM-EVIDENCE","TEAM-KERNEL"],"dependencyModuleIds":["module.scientific-evidence"],"workItemIds":["REL-001"],"qualificationRequirement":"source","protocolRange":{"minimum":1,"maximum":1},"sideEffectClasses":["none"],"determinismClass":"external_observation","resourceProfile":{"sourceContract":"bounded","deploymentProfileRequired":true,"implicitCapacityAllowed":false,"unboundedChildConcurrencyAllowed":false},"sloProfile":{"status":"source_contract_defined","canonicalWorkloadsRequired":true,"zeroToleranceSafetyCountersRequired":true},"rollout":{"currentStaticActivation":"disabled","automaticActivation":false,"productionActivation":false,"rollbackTargetRequired":true,"mutualExclusionRequired":false},"documentationStatus":"complete","effectiveQualification":"derived_only"
}
