{
  "schemaVersion":1,"kind":"ModuleDocumentationManifestV1","moduleId":"module.node-control-plane","registryRef":"docs/system/truth/modules.v1.json#/modules/module.node-control-plane","specPath":"docs/modules/specs/node-control-plane.md","runbookPath":"docs/modules/specs/node-control-plane.md#operational-runbook",
  "implementationPaths":["workflow-kernel","paper-domain","paper-application/automation/campaign-engine.mjs","paper-application/automation/campaign-prepared-result-integration.mjs"],"capabilityIds":["CAP-STATE-COMMIT","CAP-STATE-READ","CAP-EXE-DISPATCH","CAP-AUTHOR","CAP-REVIEW","CAP-FORMAL","CAP-EMPIRICAL","CAP-NUMERICAL","CAP-BUILD","CAP-SUBMIT"],"authorityClass":"central_state_write","ownerTeams":["TEAM-KERNEL","TEAM-STATE","TEAM-EVIDENCE"],"dependencyModuleIds":[],"workItemIds":["NODE-001"],"qualificationRequirement":"target_host","protocolRange":{"minimum":1,"maximum":1},"sideEffectClasses":["central_commit"],"determinismClass":"deterministic","resourceProfile":{"sourceContract":"bounded","deploymentProfileRequired":true,"implicitCapacityAllowed":false,"unboundedChildConcurrencyAllowed":false},"sloProfile":{"status":"baseline_pending","canonicalWorkloadsRequired":true,"zeroToleranceSafetyCountersRequired":true},"rollout":{"currentStaticActivation":"authoritative","automaticActivation":false,"productionActivation":false,"rollbackTargetRequired":true,"mutualExclusionRequired":true},"documentationStatus":"complete","effectiveQualification":"derived_only"
}
