{
  "schemaVersion":1,"kind":"ModuleDocumentationManifestV1","moduleId":"module.formal-node","registryRef":"docs/system/truth/modules.v1.json#/modules/module.formal-node","specPath":"docs/modules/specs/formal-node.md","runbookPath":"docs/modules/specs/formal-node.md#operational-runbook",
  "implementationPaths":["paper-domain/research","paper-adapters/runtime","rust/crates/hepta-paper-service/src/native_business.rs","rust/crates/hepta-paper-service/src/native_business/types.rs","rust/crates/hepta-paper-service/src/native_business/formal.rs","rust/crates/hepta-paper-service/src/scientific_runtime.rs","rust/crates/hepta-paper-service/src/bin/hepta-scientific-worker.rs"],"capabilityIds":["CAP-FORMAL"],"authorityClass":"prepared_result_only","ownerTeams":["TEAM-FORMAL","TEAM-EVIDENCE","TEAM-REVIEW"],"dependencyModuleIds":["module.node-control-plane"],"workItemIds":["FORMAL-001"],"qualificationRequirement":"source","protocolRange":{"minimum":1,"maximum":1},"sideEffectClasses":["local_ephemeral","workspace_mutation","prepared_result"],"determinismClass":"seeded","resourceProfile":{"sourceContract":"bounded","deploymentProfileRequired":true,"implicitCapacityAllowed":false,"unboundedChildConcurrencyAllowed":false},"sloProfile":{"status":"source_contract_defined","canonicalWorkloadsRequired":true,"zeroToleranceSafetyCountersRequired":true},"rollout":{"currentStaticActivation":"authoritative","automaticActivation":false,"productionActivation":false,"rollbackTargetRequired":true,"mutualExclusionRequired":false},"documentationStatus":"complete","effectiveQualification":"derived_only"
}
