{
  "schemaVersion":1,"kind":"ModuleDocumentationManifestV1","moduleId":"module.source-qualification","registryRef":"docs/system/truth/modules.v1.json#/modules/module.source-qualification","specPath":"docs/modules/specs/source-qualification.md","runbookPath":"docs/modules/specs/source-qualification.md#operational-runbook","implementationPaths":["docs/rust/tools","docs/rust/qualification"],"capabilityIds":["CAP-QUAL-SOURCE"],"authorityClass":"read_only","ownerTeams":["TEAM-EVIDENCE","TEAM-SRE","TEAM-KERNEL"],"dependencyModuleIds":["module.program-truth"],"workItemIds":["GAP-GOV-003","QUAL-001","QUAL-002","QUAL-003","QUAL-004","QUAL-005"],"qualificationRequirement":"source","protocolRange":{"minimum":1,"maximum":1},"sideEffectClasses":["none"],"determinismClass":"external_observation","resourceProfile":{"sourceContract":"bounded","deploymentProfileRequired":true,"implicitCapacityAllowed":false,"unboundedChildConcurrencyAllowed":false},"sloProfile":{"status":"source_contract_defined","canonicalWorkloadsRequired":true,"zeroToleranceSafetyCountersRequired":true},"rollout":{"currentStaticActivation":"disabled","automaticActivation":false,"productionActivation":false,"rollbackTargetRequired":true,"mutualExclusionRequired":false},"documentationStatus":"complete","effectiveQualification":"derived_only"
}
