{
  "schemaVersion":1,"kind":"ModuleDocumentationManifestV1","moduleId":"module.program-truth","registryRef":"docs/system/truth/modules.v1.json#/modules/module.program-truth","specPath":"docs/modules/specs/program-truth.md","runbookPath":"docs/modules/specs/program-truth.md#operational-runbook","implementationPaths":["docs/system","docs/tools"],"capabilityIds":["CAP-SYS-PROGRAM-TRUTH"],"authorityClass":"pure","ownerTeams":["TEAM-KERNEL","TEAM-EVIDENCE","TEAM-SRE"],"dependencyModuleIds":[],"workItemIds":["SYS-001","SYS-002","SYS-003","SYS-004","SYS-005","SYS-006"],"qualificationRequirement":"source","protocolRange":{"minimum":1,"maximum":1},"sideEffectClasses":["none"],"determinismClass":"deterministic","resourceProfile":{"sourceContract":"bounded","deploymentProfileRequired":true,"implicitCapacityAllowed":false,"unboundedChildConcurrencyAllowed":false},"sloProfile":{"status":"source_contract_defined","canonicalWorkloadsRequired":true,"zeroToleranceSafetyCountersRequired":true},"rollout":{"currentStaticActivation":"disabled","automaticActivation":false,"productionActivation":false,"rollbackTargetRequired":true,"mutualExclusionRequired":false},"documentationStatus":"complete","effectiveQualification":"derived_only"
}
