{
  "schemaVersion":1,"kind":"ModuleDocumentationManifestV1","moduleId":"module.reviewer-node","registryRef":"docs/system/truth/modules.v1.json#/modules/module.reviewer-node","specPath":"docs/modules/specs/reviewer-node.md","runbookPath":"docs/modules/specs/reviewer-node.md#operational-runbook","implementationPaths":["paper-application/automation","paper-domain/research","rust/crates/hepta-paper-service/src/native_business.rs","rust/crates/hepta-paper-service/src/native_business/types.rs","rust/crates/hepta-paper-service/src/native_business/reviewer.rs"],"capabilityIds":["CAP-REVIEW"],"authorityClass":"prepared_result_only","ownerTeams":["TEAM-REVIEW","TEAM-EVIDENCE","TEAM-AUTHOR"],"dependencyModuleIds":["module.node-control-plane"],"workItemIds":["REVIEW-001"],"qualificationRequirement":"source","protocolRange":{"minimum":1,"maximum":1},"sideEffectClasses":["local_ephemeral","workspace_mutation","prepared_result"],"determinismClass":"bounded_nondeterministic","resourceProfile":{"sourceContract":"bounded","deploymentProfileRequired":true,"implicitCapacityAllowed":false,"unboundedChildConcurrencyAllowed":false},"sloProfile":{"status":"source_contract_defined","canonicalWorkloadsRequired":true,"zeroToleranceSafetyCountersRequired":true},"rollout":{"currentStaticActivation":"authoritative","automaticActivation":false,"productionActivation":false,"rollbackTargetRequired":true,"mutualExclusionRequired":false},"documentationStatus":"complete","effectiveQualification":"derived_only"
}
