{
  "schemaVersion":1,"kind":"ModuleDocumentationManifestV1","moduleId":"module.rust-control-plane-service","registryRef":"docs/system/truth/modules.v1.json#/modules/module.rust-control-plane-service","specPath":"docs/modules/specs/rust-control-plane-service.md","runbookPath":"docs/modules/specs/rust-control-plane-service.md#operational-runbook","implementationPaths":["docs/control-plane/COMPOSITION_ROOT.md","rust/crates/hepta-paper-service","docs/rust/RUNTIME_MIGRATION_IMPLEMENTATION.md"],"capabilityIds":["CAP-CTL-SNAPSHOT","CAP-CTL-POLICY","CAP-EXE-DISPATCH"],"authorityClass":"prepared_result_only","ownerTeams":["TEAM-KERNEL","TEAM-RUNTIME","TEAM-EVIDENCE"],"dependencyModuleIds":["module.scheduler-core","module.execution-dispatcher","module.commit-sequencer"],"workItemIds":["CTL-001","CTL-008"],"qualificationRequirement":"source","protocolRange":{"minimum":1,"maximum":1},"sideEffectClasses":["local_ephemeral","workspace_mutation","prepared_result"],"determinismClass":"deterministic","resourceProfile":{"sourceContract":"bounded","deploymentProfileRequired":true,"implicitCapacityAllowed":false,"unboundedChildConcurrencyAllowed":false},"sloProfile":{"status":"source_contract_defined","canonicalWorkloadsRequired":true,"zeroToleranceSafetyCountersRequired":true},"rollout":{"currentStaticActivation":"disabled","automaticActivation":false,"productionActivation":false,"rollbackTargetRequired":true,"mutualExclusionRequired":false},"documentationStatus":"complete","effectiveQualification":"derived_only"
}
