{
  "schemaVersion":1,"kind":"ModuleDocumentationManifestV1","moduleId":"module.performance-qualification","registryRef":"docs/system/truth/modules.v1.json#/modules/module.performance-qualification","specPath":"docs/modules/specs/performance-qualification.md","runbookPath":"docs/modules/specs/performance-qualification.md#operational-runbook","implementationPaths": ["docs/performance","rust/crates/hepta-control-plane/src/performance_qualification.rs","rust/crates/hepta-control-plane/src/source_closure.rs"],"capabilityIds":["CAP-PERF-QUALIFICATION"],"authorityClass":"read_only","ownerTeams":["TEAM-SRE","TEAM-SCHEDULER","TEAM-EVIDENCE"],"dependencyModuleIds":["module.observability"],"workItemIds":["PERF-001","PERF-002","PERF-003"],"qualificationRequirement":"target_host","protocolRange":{"minimum":1,"maximum":1},"sideEffectClasses":["none"],"determinismClass":"deterministic","resourceProfile":{"sourceContract":"bounded","deploymentProfileRequired":true,"implicitCapacityAllowed":false,"unboundedChildConcurrencyAllowed":false},"sloProfile":{"status":"baseline_pending","canonicalWorkloadsRequired":true,"zeroToleranceSafetyCountersRequired":true},"rollout":{"currentStaticActivation":"disabled","automaticActivation":false,"productionActivation":false,"rollbackTargetRequired":true,"mutualExclusionRequired":false},"documentationStatus":"complete","effectiveQualification":"derived_only"
}
