{
  "schemaVersion":1,"kind":"ModuleDocumentationManifestV1","moduleId":"module.snapshot-builder","registryRef":"docs/system/truth/modules.v1.json#/modules/module.snapshot-builder","specPath":"docs/modules/specs/snapshot-builder.md","runbookPath":"docs/modules/specs/snapshot-builder.md#operational-runbook","implementationPaths":["paper-application/orchestration/planning-snapshot-builder.mjs","paper-application/orchestration/planning-snapshot-contract.mjs","paper-application/orchestration/planning-snapshot-canonical.mjs","docs/control-plane/PLANNING_SNAPSHOT_BUILDER_V1.md","docs/modules/schemas/planning-state-snapshot-request-v1.schema.json","docs/modules/schemas/planning-snapshot-component-v1.schema.json","docs/modules/schemas/planning-state-snapshot-v1.schema.json","docs/modules/schemas/planning-state-snapshot-currentness-receipt-v1.schema.json","docs/control-plane/COMPOSITION_ROOT.md","rust/crates/hepta-orchestration-kernel/src/snapshot.rs","rust/crates/hepta-orchestration-kernel/HANDOFF.md"],"capabilityIds":["CAP-CTL-SNAPSHOT"],"authorityClass":"read_only","ownerTeams":["TEAM-KERNEL","TEAM-STATE","TEAM-EVIDENCE"],"dependencyModuleIds":["module.module-registry","module.readonly-control"],"workItemIds":["CTL-002"],"qualificationRequirement":"source","protocolRange":{"minimum":1,"maximum":1},"sideEffectClasses":["none"],"determinismClass":"deterministic","resourceProfile":{"sourceContract":"bounded","deploymentProfileRequired":true,"implicitCapacityAllowed":false,"unboundedChildConcurrencyAllowed":false},"sloProfile":{"status":"source_contract_defined","canonicalWorkloadsRequired":true,"zeroToleranceSafetyCountersRequired":true},"rollout":{"currentStaticActivation":"disabled","automaticActivation":false,"productionActivation":false,"rollbackTargetRequired":true,"mutualExclusionRequired":false},"documentationStatus":"complete","effectiveQualification":"derived_only"
}
