{
  "schemaVersion":1,"kind":"ModuleDocumentationManifestV1","moduleId":"module.observability","registryRef":"docs/system/truth/modules.v1.json#/modules/module.observability","specPath":"docs/modules/specs/observability.md","runbookPath":"docs/modules/specs/observability.md#operational-runbook",
  "implementationPaths": ["docs/control-plane/OBSERVABILITY_MODEL.md","paper-application/automation/resource-governor.mjs","rust/crates/hepta-control-plane"],"capabilityIds":["CAP-OBS-TELEMETRY"],"authorityClass":"read_only","ownerTeams":["TEAM-SRE","TEAM-SCHEDULER","TEAM-EVIDENCE"],"dependencyModuleIds":[],"workItemIds":["OBS-001","OBS-002"],"qualificationRequirement":"source","protocolRange":{"minimum":1,"maximum":1},"sideEffectClasses":["none"],"determinismClass":"deterministic","resourceProfile":{"sourceContract":"bounded","deploymentProfileRequired":true,"implicitCapacityAllowed":false,"unboundedChildConcurrencyAllowed":false},"sloProfile":{"status":"source_contract_defined","canonicalWorkloadsRequired":true,"zeroToleranceSafetyCountersRequired":true},"rollout":{"currentStaticActivation":"disabled","automaticActivation":false,"productionActivation":false,"rollbackTargetRequired":true,"mutualExclusionRequired":false},"documentationStatus":"complete","effectiveQualification":"derived_only"
}
