{
  "schemaVersion":1,"kind":"ModuleDocumentationManifestV1","moduleId":"module.workspace-authority","registryRef":"docs/system/truth/modules.v1.json#/modules/module.workspace-authority","specPath":"docs/modules/specs/workspace-authority.md","runbookPath":"docs/modules/specs/workspace-authority.md#operational-runbook","implementationPaths":["rust/crates/hepta-workspace","rust/crates/hepta-workspace-authority","docs/modules/WORKSPACE_IMPLEMENTATIONS_HANDOFF.md"],"capabilityIds":["CAP-WS-AUTHORITY"],"authorityClass":"prepared_result_only","ownerTeams":["TEAM-WORKSPACE","TEAM-STATE","TEAM-EVIDENCE"],"dependencyModuleIds":["module.protocol-kernel"],"workItemIds":["MIG-003","GAP-HOST-002"],"qualificationRequirement":"target_host","protocolRange":{"minimum":1,"maximum":1},"sideEffectClasses":["local_ephemeral","workspace_mutation","prepared_result"],"determinismClass":"deterministic","resourceProfile":{"sourceContract":"bounded","deploymentProfileRequired":true,"implicitCapacityAllowed":false,"unboundedChildConcurrencyAllowed":false},"sloProfile":{"status":"baseline_pending","canonicalWorkloadsRequired":true,"zeroToleranceSafetyCountersRequired":true},"rollout":{"currentStaticActivation":"disabled","automaticActivation":false,"productionActivation":false,"rollbackTargetRequired":true,"mutualExclusionRequired":false},"documentationStatus":"complete","effectiveQualification":"derived_only"
}
