{
  "schemaVersion":1,"kind":"ModuleDocumentationManifestV1","moduleId":"module.rust-local-vertical","registryRef":"docs/system/truth/modules.v1.json#/modules/module.rust-local-vertical","specPath":"docs/modules/specs/rust-local-vertical.md","runbookPath":"docs/modules/specs/rust-local-vertical.md#operational-runbook","implementationPaths":["rust/crates/hepta-local-vertical","rust/crates/hepta-local-vertical/tests/local_slice.rs"],"capabilityIds":["CAP-MOD-EXECUTION","CAP-EVD-VERIFY","CAP-AUTHOR","CAP-REVIEW","CAP-BUILD"],"authorityClass":"prepared_result_only","ownerTeams":["TEAM-KERNEL","TEAM-WORKSPACE","TEAM-EVIDENCE"],"dependencyModuleIds":["module.codex-broker","module.workspace-authority","module.readonly-control","module.commit-sequencer"],"workItemIds":["CTL-006"],"qualificationRequirement":"source","protocolRange":{"minimum":1,"maximum":1},"sideEffectClasses":["local_ephemeral","workspace_mutation","prepared_result"],"determinismClass":"bounded_nondeterministic","resourceProfile":{"sourceContract":"bounded","deploymentProfileRequired":true,"implicitCapacityAllowed":false,"unboundedChildConcurrencyAllowed":false},"sloProfile":{"status":"source_contract_defined","canonicalWorkloadsRequired":true,"zeroToleranceSafetyCountersRequired":true},"rollout":{"currentStaticActivation":"disabled","automaticActivation":false,"productionActivation":false,"rollbackTargetRequired":true,"mutualExclusionRequired":false},"documentationStatus":"complete","effectiveQualification":"derived_only"
}
