{
  "schemaVersion":1,"kind":"ModuleDocumentationManifestV1","moduleId":"module.readonly-control","registryRef":"docs/system/truth/modules.v1.json#/modules/module.readonly-control","specPath":"docs/modules/specs/readonly-control.md","runbookPath":"docs/modules/specs/readonly-control.md#operational-runbook","implementationPaths":["rust/crates/hepta-readonly-store","rust/crates/hepta-readonly-control"],"capabilityIds":["CAP-STATE-READ"],"authorityClass":"read_only","ownerTeams":["TEAM-STATE","TEAM-PROTOCOL","TEAM-EVIDENCE"],"dependencyModuleIds":["module.protocol-kernel"],"workItemIds":["CTL-002"],"qualificationRequirement":"source","protocolRange":{"minimum":1,"maximum":1},"sideEffectClasses":["none"],"determinismClass":"deterministic","resourceProfile":{"sourceContract":"bounded","deploymentProfileRequired":true,"implicitCapacityAllowed":false,"unboundedChildConcurrencyAllowed":false},"sloProfile":{"status":"source_contract_defined","canonicalWorkloadsRequired":true,"zeroToleranceSafetyCountersRequired":true},"rollout":{"currentStaticActivation":"disabled","automaticActivation":false,"productionActivation":false,"rollbackTargetRequired":true,"mutualExclusionRequired":false},"documentationStatus":"complete","effectiveQualification":"derived_only"
}
