{
  "schemaVersion":1,"kind":"ModuleDocumentationManifestV1","moduleId":"module.protocol-kernel","registryRef":"docs/system/truth/modules.v1.json#/modules/module.protocol-kernel","specPath":"docs/modules/specs/protocol-kernel.md","runbookPath":"docs/modules/specs/protocol-kernel.md#operational-runbook","implementationPaths":["workflow-kernel","paper-domain/contracts","rust/crates/hepta-codex-protocol"],"capabilityIds":["CAP-PROTOCOL-CANONICAL"],"authorityClass":"pure","ownerTeams":["TEAM-PROTOCOL","TEAM-KERNEL","TEAM-EVIDENCE"],"dependencyModuleIds":[],"workItemIds":["MOD-006"],"qualificationRequirement":"source","protocolRange":{"minimum":1,"maximum":1},"sideEffectClasses":["none"],"determinismClass":"deterministic","resourceProfile":{"sourceContract":"bounded","deploymentProfileRequired":true,"implicitCapacityAllowed":false,"unboundedChildConcurrencyAllowed":false},"sloProfile":{"status":"source_contract_defined","canonicalWorkloadsRequired":true,"zeroToleranceSafetyCountersRequired":true},"rollout":{"currentStaticActivation":"authoritative","automaticActivation":false,"productionActivation":false,"rollbackTargetRequired":true,"mutualExclusionRequired":false},"documentationStatus":"complete","effectiveQualification":"derived_only"
}
