{
  "schemaVersion": 1,
  "kind": "ModuleDocumentationManifestV1",
  "moduleId": "module.numerical-node",
  "registryRef": "docs/system/truth/modules.v1.json#/modules/module.numerical-node",
  "specPath": "docs/modules/specs/numerical-node.md",
  "runbookPath": "docs/modules/specs/numerical-node.md#operational-runbook",
  "implementationPaths": [
    "numerical-plugins",
    "paper-adapters/runtime",
    "rust/crates/hepta-paper-service/src/native_business.rs",
    "rust/crates/hepta-paper-service/src/native_business/types.rs",
    "rust/crates/hepta-paper-service/src/native_business/numerical.rs",
    "rust/crates/hepta-paper-service/src/advanced_numerical.rs",
    "rust/crates/hepta-paper-service/src/bin/hepta-paper-rust.rs",
    "rust/crates/hepta-paper-service/src/scientific_runtime.rs",
    "rust/crates/hepta-paper-service/src/bin/hepta-scientific-worker.rs"
  ],
  "capabilityIds": [
    "CAP-NUMERICAL"
  ],
  "authorityClass": "prepared_result_only",
  "ownerTeams": [
    "TEAM-NUMERICAL",
    "TEAM-EMPIRICAL",
    "TEAM-EVIDENCE"
  ],
  "dependencyModuleIds": [
    "module.node-control-plane"
  ],
  "workItemIds": [
    "NUM-001"
  ],
  "qualificationRequirement": "source",
  "protocolRange": {
    "minimum": 1,
    "maximum": 1
  },
  "sideEffectClasses": [
    "local_ephemeral",
    "workspace_mutation",
    "prepared_result"
  ],
  "determinismClass": "seeded",
  "resourceProfile": {
    "sourceContract": "bounded",
    "deploymentProfileRequired": true,
    "implicitCapacityAllowed": false,
    "unboundedChildConcurrencyAllowed": false
  },
  "sloProfile": {
    "status": "source_contract_defined",
    "canonicalWorkloadsRequired": true,
    "zeroToleranceSafetyCountersRequired": true
  },
  "rollout": {
    "currentStaticActivation": "authoritative",
    "automaticActivation": false,
    "productionActivation": false,
    "rollbackTargetRequired": true,
    "mutualExclusionRequired": false
  },
  "documentationStatus": "complete",
  "effectiveQualification": "derived_only"
}
