{
  "schemaVersion":1,"kind":"ModuleDocumentationManifestV1","moduleId":"module.qualification-ingest","registryRef":"docs/system/truth/modules.v1.json#/modules/module.qualification-ingest","specPath":"docs/modules/specs/qualification-ingest.md","runbookPath":"docs/modules/specs/qualification-ingest.md#operational-runbook","implementationPaths":["rust/crates/hepta-qualification-ingest"],"capabilityIds":["CAP-QUAL-SOURCE","CAP-REL-VERIFY"],"authorityClass":"read_only","ownerTeams":["TEAM-EVIDENCE","TEAM-RELEASE","TEAM-KERNEL"],"dependencyModuleIds":["module.external-authority-verifier"],"workItemIds":["GAP-REL-001"],"qualificationRequirement":"source","protocolRange":{"minimum":1,"maximum":1},"sideEffectClasses":["none"],"determinismClass":"external_observation","resourceProfile":{"sourceContract":"bounded","deploymentProfileRequired":true,"implicitCapacityAllowed":false,"unboundedChildConcurrencyAllowed":false},"sloProfile":{"status":"source_contract_defined","canonicalWorkloadsRequired":true,"zeroToleranceSafetyCountersRequired":true},"rollout":{"currentStaticActivation":"disabled","automaticActivation":false,"productionActivation":false,"rollbackTargetRequired":true,"mutualExclusionRequired":false},"documentationStatus":"complete","effectiveQualification":"derived_only"
}
